68499588,天马星,2019-10-26 02:04:37,影片拍出了很多青春片都没有的青春本质：学会长大，可是怎么学呢？从没有人教过我们，那些不安惶恐与孤独就像梦魇一点一点吞噬灵魂。但是如果只把影片当成简单的青春片就太小看它了，影片最终探讨还是人，人的阶级属性，人的善恶属性，从这点来看，影片是国内版的《寄生虫》。二刷之后，我最喜欢导演最后一场戏的处理：陈念去看守所探视小北，两人啥都没说，两人就对视着，对视着，从笑到哭，又从哭到笑，这时观众已经明了两人已经说过了千言万语。最后两人坐上了警车，陈念最后一次和小北对话，其实两人是坐在两辆车上的，现实中两人并未对话，但窗外的光不时打在两人的眼上，两人虽未对视，但却像探视时对视一样，只不过这一次他们是通过光把话带给对方。多好的处理啊，两人深刻的羁绊，就在光与影的交会中深深刻在观众心里，这就是电影的魅力啊。,力荐,45,30166972,少年的你
xiaoxiaodeyuanz,远子,2019-10-27 10:58:20,有非常真实摄人的一面，有较为隐蔽的控诉，演技遮盖了俗套的悬疑设定，值得一看。,推荐,47,30166972,少年的你
148086677,木子,2019-10-25 11:10:04,温馨提示，别化妆带着纸巾，我也是心理很强大了，花着妆出来直接买了下一场的直接二刷了，这部剧真的很好看！深刻真实，周冬雨的演技真的厉害，眼泪说掉就掉了，还有最让我惊喜的四字弟弟，这部电影真的可以证明他演技的代表作了，他在流量小生中真的非常非常优秀的了！强推！,力荐,114,30166972,少年的你
mujun_soc,周沐君,2019-10-27 11:47:22,太长了。看到后来头疼。千玺的脸真适合大荧幕。希望他早日成为真正的演员。,推荐,47,30166972,少年的你
146536630,木石子,2019-10-25 11:31:41,两次校园欺凌的终结，一次是受害人的死亡，一次是加害者的死亡。前者是电影的开始，后者是电影的结束。陈念面对校园暴力，先是沉默，然后寻求合法渠道，最后以暴易暴，可都宣告失败！冰冻三尺非一日之寒，若要冰消，恐怕也得花好长时间吧！,推荐,83,30166972,少年的你
169578496,氹氹仔,2019-10-25 11:08:10,这部电影题材很现实很有社会意义，怪不得这么艰难！两位主演虽然年龄差了很多，但搭在一起真的很适合不会让人出戏！冬雨还是一如既往的发挥稳定，金马影后嘛！四字弟弟接这部戏虽然没经过科班的磨练，但眼神里都是戏，虽有青涩但表演张力还是不错的，很有天分！金马奖制作班底更是为这部电影保驾护航了！不错！,力荐,123,30166972,少年的你
malingcat,malingcat,2019-11-29 09:19:40,如此多的暴力，而最暴力的还是那个巨大的考试机器，导演给了“考试工厂”和高考场景那么多的篇幅，是有原因的。我们的教育制度，不培养正义感和人性，寒门子弟固然可以从“分数面前人人平等”中受益，但是这种比拼终究是残酷无情的，场景宏大的宣誓，孔明灯，飞撒一地的碎纸，掩盖不了这种残酷。魏莱等人的暴力从何而来，班主任和学校的不作为从何而来，缺少一个连接。少年的你们，以为考完了、步入社会了就是解放，实则不然，即将面对的成人世界一样暴力。所以陈念教孩子念着：“我们曾经在乐园里”。,推荐,27,30166972,少年的你
3115360,南茜,2019-10-27 03:26:58,东野圭吾精选集真好看,很差,30,30166972,少年的你
180447937,追风的女儿,2019-10-28 14:58:38,"      3分，不能再多了😂
      冲着豆瓣8.7和票圈诸多好评去的，结果挺失望。
      剧情逻辑混乱，人物定位不清。
      对于这种主题，应该很容易赚眼泪的，结果也并没有。
      票圈说周冬雨和四字弟弟演技爆表，额，好像根本不需要演技吧，当然剧本硬伤比较大。。
      化妆师水平不错，给演员“演技”加分了。
      片子太压抑太长，实名不推荐😅😅",很差,18,30166972,少年的你
162077474,小丹丹,2019-10-25 11:24:14,"作为两个孩子的母亲，已经不适宜也不愿意浪费陪伴孩子的时间，去接触那些常规意义上的“青春片”了。这次吸引我走进电影院的，是与孩子成长有关的“守护”、“相信”和“疼痛”。 是的，影片基调是暗的，灰白灰白。冷漠的社会、漠然的人群、自私的个体……但少年，却是鲜活的，想反抗、想改变、想逃离……正因为如此，少年间的感情才愈发美好温暖啊!说实话，我是爱这种反差的。不刻意、不迎合，敢于揭示、勇敢爱。所有的这些，导演越是不刻意制造，观众的感受就越是深刻。各种人物的细微、琐碎、随机和注定，仿佛积攒成了一股力量，森冷却蓬勃。这种反差，反而很抓心，让人生疼、心痛，却无语、凝噎。 
那时只有17岁的易烊千玺演绎的""小北""着着实实让老阿姨""疼痛""了一把，我不得不承认他的努力和天赋。孩子，好好走，路还很长。看好你[玫瑰]",力荐,96,30166972,少年的你
182149691,SLAM,2019-10-25 11:28:15,看完不知道说什么好，希望通过这部电影可以让这个社会更加关注校园暴力，周冬雨的演技真的很棒，他们俩还挺有cp感，弟弟真的惊到我了，没进科班学习前竟然可以拍的这么好，特别是眼神，好多地方我看到他的眼神我一下子就动容了，就完全可以感受到其中的情感，期待弟弟以后的作品，郑警官演的也很好，特别是说小北死刑那段。平常大家所知道的校园暴力者都是不学习的学生但是这个电影演绎的是同样是好学生，并且不是明白着的欺负，这也是我们所要关注的焦点，看完心情很沉重，但是值得二刷。,力荐,102,30166972,少年的你
185661074,我hello弟弟,2019-10-25 11:26:46,"你保护世界，我保护你，相信""相信""本身!
故事以倒序展开，这曾是我们最好的乐园！我们以彼此为依靠！在校园，我们可能都曾被孤立过，被欺负过，我们需要勇敢说出来！陈念和小北两个人因为彼此对生活充满希望！要么选择被欺负要么选择加入他们，一起欺负他人！故事讲的真的很好，剧情感人真实，演员演技在线 他们眼神里有戏，仿佛他们就是角色本身能，带很好的带入剧情！祝《少年的你》票房大卖！",力荐,90,30166972,少年的你
qiweiming750,Morning,2019-10-27 00:30:00,三星半。如果做电影分成两部分，提出目标和实现目标，我会觉得前者几乎可以拿到满分，围绕着演员状态穿插起来的前因后果的叙事，像是对一种法制陈述和专题片叙事的借鉴，伴随而来的剪辑也很重要，包括摄影将概念化进行到底，甚至小到比任何一个内地导演还要明白内地校服是什么样子这样的细节上，这个团队有汇聚力量去挑战的一面。但是实现目标这一幅度内，我就觉得乏善可陈，电影的主题内核实际上是逐渐变化的，将种种主题点作为了一个观众代入的臆想反派，讲到霸凌就是霸凌很恐怖，讲到高考就是高考很冷漠，讲到成人就是成人更加无情，在小的题点上不停的变化，没有试图到更深，节奏也很平均，常常同样大场的对话戏接在一起，到了最后就是要讲这个世界一无是处，我觉得是一种有内容的失控，比较像是有个妇人絮絮叨叨，也不是不能听，但就是不够智慧。,还行,29,30166972,少年的你
179853310,陷落美好,2019-10-25 11:09:06,这样的题材我是第一次看，千玺的表现真的超乎我的想象。太棒了，以后的你会越来越好的。,力荐,105,30166972,少年的你
helizhanglao,河狸,2019-10-27 01:49:55,按理说辛苦拍摄的演员和工作人员不应该背原著的锅，但是也不能因此就助长歪风邪气啊。,很差,27,30166972,少年的你
184691768,我叫叶zhizhi,2019-10-25 11:26:26,"看完了电影，真的真的真的很值得去看。
你保护世界，我保护你。
少年的你，青涩，无畏，勇敢。
去和暴力说不！",力荐,92,30166972,少年的你
57634132,萨罗迈拉,2019-10-26 12:37:33,从椅子上那滩红墨水开始，我的眼泪就没停过。整部电影弥漫着脚踏实地的绝望，以被霸凌的高考生陈念作为整个故事的前景，掀开了藏在课本后面的“屠杀”。写实程度让我恍然觉得在看某一部分的人生，那些拼搏的口号、翻烂的书本、母亲清晨起床的背影、去北京就能改变命运的执念、走投无路只能哭的夜晚，全都想起来了。而小北、母亲、同学组成的后景，全都被什么追赶着直到走投无路，因而“高考”就成了信仰，被赋予唯一的出路。可惜我们的青春里没有小北，我们自己擦干眼泪走出来，逼自己成为现在的大人。其实最让我感动的是，导演拍底层，不是俯视而是平视，悲悯之中满含尊重，让我们直视他们的眼睛，看每个人拼尽全力地活。联想到电影本身的命运，其实也是一个被欺负的“孩子”，保护好这样的电影，就保护了一部分电影的未来。,力荐,38,30166972,少年的你
120556744,二号宝瑞,2019-10-27 10:50:57,小说完全当做玛丽苏言情小说来看的，然后电影又想要升华主题，然而东一锤子西一棒子，搞什么悬疑推理？不伦不类,较差,19,30166972,少年的你
10770715,阳sir,2019-10-26 18:50:43,那个女警察问陈念为什么不信老师、不信学校、不信警察，她心里真的没有答案吗？陈念算是幸运的了，如果你真的有过上学期间被全班孤立过、被欺负过，你会知道你的身后没有小北的，没有垃圾桶里地放过，只有熬着再熬着。,推荐,42,30166972,少年的你
2473154,貓小三的意思其實是如果先生,2019-10-26 21:33:56,演员很好，感情也很好。拍摄和剪辑上的瑕疵明显到非常影响体验，派出所高强柔光是一例，不遗余力张弛无度的2/3脸特写是一例。Ps：她不止是第一个问你疼不疼的人，还是第一个问你硬不硬的人。,还行,31,30166972,少年的你
yellowmoonbird,晚不安,2019-10-28 13:39:33,"2010年代，华语青春片以泥沙俱下又势如破竹的面貌出现在新一代的观众面前。错误的观念被建立和拥护，不甘心的人把力量慢慢聚拢，然后有了《狗十三》《嘉年华》《过春天》《少年的你》，击穿太平无事下的为赋新诗强说愁。
周冬雨的雀斑和张雪迎长满粉刺的额头一样，都是刺破光鲜亮丽的虚伪的第一步。然后是事件和表现事件的方法，谁坠了楼谁挨了打谁装上了铁栏杆。接着是真实的限度，在社会议题里到底为现实打多少柔光，为爱情用多少蒙太奇，为结局用多少真实可怖之眼泪。最后是目标和技术，类型还是“地下”，市场还是作者，导编摄剪演完成到什么程度。团队做完全部的选择，大部分是对的。二刷完认定摄影是最突出的。
曾国祥完全证明了自己是一个专业、优秀的导演，他的出色在于把一个原本深刻但极易陷入廉价的故事拍得高级，而《药神》恰恰相反。",推荐,27,30166972,少年的你
166292943,城北有信使,2019-10-25 11:46:15,刚从影院出来，妥妥被四字弟弟圈粉！没有接受过专业的学习，可是一点也不输人。他的眼神太神奇了，会说话，有穿透力，第一次看到这样一双眼睛，令人心疼。他的眼神里透露出和本身年龄不一样的成熟感，真的很神奇，小北是个离他太过遥远的社会群体，可是他就是小北，小北也是他。他真的太有塑造力了，永远期待他不设限的未来。“你赢了，我们就不算输。”易烊千玺赢了，小北就不算输。,力荐,93,30166972,少年的你
vivian_levis,寂寞牌食之谜,2019-10-27 09:17:55,太尴尬的电影,很差,23,30166972,少年的你
btr,btr,2019-10-27 19:19:30,#长宁来福士  四星半。曾国祥有一种将情绪或无法言说的东西影像化（包括利用声音）的能力，作者风格在这部片中也更成熟。校园霸凌和爱情，缺席的父（母）亲和社会大气象，电影层次也足够丰富。只要去掉那些金句，后半段的节奏更紧凑些，就是满分。,力荐,40,30166972,少年的你
MeloTheFisher,烟波人长安,2019-10-25 12:05:01,有些超出预期，尤其是有一段女警察质问周冬雨“为什么不相信大人”，周冬雨露出一张复杂的嘲讽脸，像是在反问“跟你们说了，有用吗？”,推荐,40,30166972,少年的你
149152146,顗礼,2019-10-25 23:21:04,"正义无奈、理想无能、操蛋的世界谋杀了未来。
“如果世界是这样的话，你还愿意把你的孩子生出来吗？”把这句台词写出来，拍出来，并且用镜头语言跟前文的铺垫呼应出来，这个年轻的主创团队就赢了，“大人们”口口声声的说要保护“少年”，可最后的结果又是怎样呢？这就是对校园霸凌问题最深刻的反思，他们真的太勇敢了；中后段审讯室的部分大概是近十年来，不，应该是本世纪以来最高光的青春片段落，二人互为补充的空间构图、“大人”与“少年”间理想与现实的博弈、超高光与阴阳脸的对比，以及声画契合度惊艳到可怕的蒙太奇，太牛逼了。BTW，曾国祥正式成为最适合拍东野圭吾的中国导演",推荐,46,30166972,少年的你
angle223,不良生,2019-10-30 00:36:10,永远不要怀疑人性当中恶的那一部分，也不要以为它只会存在于成人的世界里。少年的宇宙有牺牲与甘愿，同样有软弱与欺凌；大人的森林有迂回与污秽，同样也有护全与真理。所以这与少年是否能够对抗大人的世界无关，而与人性幽微有染。丰美优沃的土壤能包裹畸形的根茎，腐烂黝黑的烂泥也能栽育清亮生动的花蒂。,力荐,26,30166972,少年的你
colinpark,西帕克,2019-10-26 09:14:00,曾国祥用显微镜一般的特写捕捉下每一张脸，不管是加害者，受害者还是旁观者，每一个细小的情绪都被放至最大。后半段转变为推理悬疑，互相否认却是深爱的证明，又虐又美。最终，一切又归于那只无形的手，让少年过早长大，过早跳入那片河流。,推荐,37,30166972,少年的你
xuyimeng,小A萌,2019-10-26 11:19:59,台詞寫了「從來沒有一節課教過我們，如何變成大人。」拍這部電影的過程也像一節課，它教會我們，如何做回少年。,力荐,46,30166972,少年的你
145264332,悲伤蛙,2019-10-25 12:02:01,我们在绝望黑暗的生活里互相打上一束光，你保护世界，我保护你。,力荐,75,30166972,少年的你
107034391,Jooooooc,2019-10-25 11:18:22,谁能想到 一个人在电影院看的默默哭泣呢 易烊千玺的演技🉑️,力荐,80,30166972,少年的你
Scarlett1020,你看起来很美味,2019-10-26 20:10:23,其实想给四星，但是导演的镜头语言真的太棒了，曾国祥太会拍了，感觉所有意象信手拈来好不费事，周冬雨真的灵到不行，易烊千玺更是惊喜。两个人最后对视那场戏的层次太丰满了。所以多给一星。希望曾导能拍出更好的电影。,力荐,48,30166972,少年的你
mario6688,鹿菏,2019-10-29 21:31:37, 在黑暗的电影院默默流了一个多小时的泪，出来的时候眼泪已经酸涩到快睁不开。我以为那个高中时期被霸凌的黑暗记忆已经模糊，那些曾经发生的事也都被我刻意遗忘，可是看到这部电影里那些熟悉的段落时才知道有些伤害永远都不会消失，只是被厚厚的结痂包裹住了，就算脱落伤口痕迹也会永存……,力荐,28,30166972,少年的你
5054748,闲人,2019-10-25 13:02:41,其实有点四六不靠，对校园凌霸这个议题的探讨没能处理得特别深入，前半部分男主角的戏份过少，导致爱情戏的部分看起来有点突兀，像是用商业类型片的素材做了一部文艺片。不过整个制作成色还是不错的，整体不如导演上一部《七月与安生》。,还行,37,30166972,少年的你
jywpl,獨孤島主,2019-10-28 11:26:20,时间太久不记得《白夜行》具体的展开方式，所以不讨论这个问题。直觉上，个人觉得《少年的你》里小北对陈念的情义非常逼近王度庐《古城新月》中柏俊青对白月梅的感情，那种“我一生都是失败，唯有你是我的成功”的彻骨卑绝，就好像在改换了年龄差的《少年的你》里原样复制了一遍，但导演绝对没功夫读这本小说。电影营造出令观众完全浸入的中国景观，也可能有点让习惯了掐头去尾斩中间国片的观众感到意外。上映首日，几乎所有看过此片的朋友圈，无论正在过着什么样的日子，都把自己代入了资深边缘人的角色，这才教人大开眼界。,推荐,20,30166972,少年的你
198699441,豆友198699441,2019-10-25 10:52:42,千玺演技棒棒哒👍！,力荐,82,30166972,少年的你
wangzhanhei,Heattech小伙,2019-10-27 18:52:52,年轻真好啊 年轻就是干 和这个烂世界互干到头破血流,推荐,37,30166972,少年的你
itzhaoxiangyu,心生,2019-10-26 20:31:45,9分。聚焦校园霸凌这个话题本身，已非常难得。那场凌辱戏拍得真实又绝望，会不自主想起真实案例的视频，越想越难过。周冬雨的表演一如既往的棒，藏在角色背后，把力量赋予角色，所有情绪从角色直达观者的心里，又是一次影后级表演。易烊千玺也非常棒，准确而克制，最触动人心的是他在哭泣时整个脸部肌肉的轻微抖动，所有的无奈、愤怒、心酸与祝福都在里面了。两人在监狱里对视那场戏，没有台词，但情绪会有几次起伏，且彼此倒映在画面里的玻璃上，很出彩的一场戏，两个人都完美消化了。片子有一种压抑感，融合了复杂情绪最终汇成的压抑，它源自受霸凌对象的内心痛苦，并扩散到影片每个角落。类似悲剧不会就此终结，但期待社会的不断聚焦和凝视，能产生更多有效的抑制力量，让乐园依旧是乐园，不会成为一些人的“used to be”,力荐,46,30166972,少年的你
76154263,没事写写豆瓣,2019-10-27 08:25:01,共生关系可不就是白夜行吗！！！,很差,18,30166972,少年的你
119881201,好像饮了风-,2019-10-26 13:45:29,以后都当文学裁缝好了 ,很差,10,30166972,少年的你
200804495,乱讲噻,2019-10-28 14:41:24,好一部嫌疑人周冬雨的白夜自首演技爆表献身行👏,很差,18,30166972,少年的你
sophiechou,迷特波鲁,2019-10-27 21:29:55,剧情其实一般，但是四字和周冬雨演得实在是太太太好了！弟弟太帅了orz,推荐,23,30166972,少年的你
198124184,痴迷张碳碳的小,2019-10-25 09:58:25,"“这个世界其实没那么黑暗，你可能总会遇到一个人或是一些朋友，他们会愿意去帮助你，而且你不是孤单的。” 
确实朋友是生活的指路明灯，电影的初心很好。
建议正处在青春期的同学都看一看。",力荐,79,30166972,少年的你
160756382,王治.Eden,2019-10-27 07:40:45,导演真的应该多看看同类的韩国片比如《韩公主》，跟人家学学怎么拍这样的电影…镜头对着演员打脸猛拍啊，演技不行你一遍遍的照女主雀斑和男主脸上疤痕有什么用？,很差,21,30166972,少年的你
182642037,张宏毅毅,2019-10-28 16:25:24,后面的老头带了一女的，抱着看，女的看到一半走了 老头也睡着了,较差,8,30166972,少年的你
62675594,赫恩曼尼,2019-10-29 23:54:08,1. 千玺的帅气，在于他帅而不自知，这是他和流量咖的本质区别；2. 粉了千玺六年，当他在银幕上哭哭笑笑的时候，觉得他就是小北本人，从这一点看，这戏成了；3. 周冬雨的哭戏超越了技巧，原来演员和观众的眼泪是可以共振的；4. 戏的立意有价值，又因为撤档、紧急排档等一系列背景和演员的精湛表演，口碑爆棚；5. 并不能只因这些因素，就认定这是一部艺术和技巧上都高超的电影，情感处理的细腻掩盖不了节奏的缺陷，人物的真实同时暴露了其他人物的扁平虚伪，结尾的引导并没有化解根本的矛盾。6. 只能说它引起了观众对被欺凌者的同情，指出了若干问题，但最终的一拳却打偏了，没有命中症结，而选择了以少年间的袒护、浪漫化的叙事、突然死亡的突兀戏码。7. 《少年的你》播出了，真为它高兴，也为千玺高兴。请继续做生机勃勃的少年吧！,推荐,26,30166972,少年的你
movieater,女神的秋裤,2019-10-25 22:07:37,没想到能把校园欺凌拍得这么引人入胜。完成度非常高，手持镜头、近身特写、交叉剪辑这些镜头语言非常丰富，演技无痕，最重要的是“真实”和“现实”。不是学校无为，而是无力，也不是警察无能，是无奈，问题也不只是欺凌，而是社会的真相。当宣誓和肮脏罪恶的角落剪辑在一起，讽刺得生猛又戳心。片子能上，不容易。,推荐,30,30166972,少年的你
10345879,赵启辰,2019-10-26 17:28:36,这部片能上映是今年唯一让我感到欣慰的事，它的力量让我反思自己做为一个成年人的一切，和做为从业者的一切。我很惭愧，也很抱歉。希望这些羞愧和自责可以转化为力量。,力荐,35,30166972,少年的你
stevecarell,基瑞尔,2019-10-25 12:38:40,实力放大版《悲伤逆流成河》 ，继续对霸凌给予最宝贵和真诚的关注。对于招牌白底黑字和片尾喊话已经心累，只能正面想到陈念关于“找你们有用吗”的那段呼喊已是范围内最大的努力。感觉两位演员被用得很好，电话两端的隐忍与嚎啕，之于周冬雨是对情绪戏控制的精准体现；有些远景的处理，和角色形象带来的本身不多的台词设计，对尚算新人的易烊千玺减轻了莫名的压力。那段有距离的守护，以及同走夜路的陪伴，是每个人都曾渴望的善意。,推荐,42,30166972,少年的你
145365996,Zac_Zhao,2019-10-26 15:01:05,🐶,很差,14,30166972,少年的你
153711744,🐻小山,2019-10-25 12:01:54,小北啊啊啊啊啊啊😭 这部电影，真的很棒！易烊千玺塑造角色的能力，真的很棒！看进去了！陷在里面透透的！还有周冬雨！真的也演的很棒啊啊啊啊啊啊 不说了！我吹爆😭 ,力荐,66,30166972,少年的你
69209955,.,2019-10-25 11:36:59,过于真实 引起不适 建议学校集体观看,推荐,63,30166972,少年的你
timbernord,TimberNord,2019-10-27 22:53:47, 前面很棒，后面拖沓了，好可惜！加一星鼓励,推荐,21,30166972,少年的你
145535232,储西,2019-10-25 11:20:39,每个人都会看到自己或多或少的影子，谢谢谢谢谢谢这部电影让我从头哭到尾。陈念谢谢你没放弃啊，小北，我期望着你的期望。♥️,力荐,75,30166972,少年的你
182491718,whyme,2019-10-28 16:42:29,嫌疑人小北的献身,很差,12,30166972,少年的你
maomaocao,紫苏,2019-10-25 12:06:22,曾国祥把易烊千玺拍出了张震的感觉！,力荐,64,30166972,少年的你
hjt8844,孟浪,2019-10-25 21:41:17,更像是中国版的《寄生虫》，校园欺凌和犯罪推理只是构成社会寓言的两大提喻手段，对阶级固化的讽刺和人性之恶的拷问才是整部电影最隐晦最本色的指向。影片的最大妙笔是没有把人物进行绝对化处理，尤其是周冬雨一角所承担的伤害、隐忍、反扑，这一系列的转变使电影有了更为深刻的内涵——人性的善恶转变有时就在一念之间，受害者某种程度上也是促成恶的一部分，复杂的社会链条中根本没有无辜的人。另外，山城重庆的空间结构以及各个人物的人名也在电影中化为了一种只可意会的次语言，并和司法审判、高考制度这类看似构成社会平等的治理政策形成了皮相之间的对比。当然，某些金句台词也写的太过直接，有点不符合现实情况，结尾又急转为光明的套路，这些也导致电影没有更上一层楼。,推荐,22,30166972,少年的你
Enjolras0712,Enjolras,2019-10-25 16:32:35,我观影时不幸步入了一个49个小女生加我一个中年男人的尴尬场次，当周冬雨问易烊千玺“硬不硬？”时，我听见了两个手机摔在地上的声音……,推荐,27,30166972,少年的你
mydear1011,城南草木生,2019-10-26 02:15:37,少年的你真好看。导演摄影演员剧本样样好，曾国祥好，易烊千玺好，周冬雨好，余静萍好，很多个好像差不多就行了的细节都能感觉到人家在较真和死磕。片尾看到了画着框的卢凯彤的名字，她给电影写了一首歌，叫FLY。卢凯彤是这部电影的摄影余静萍的爱人，电影拍到一半，还去重庆探过班的爱人不在了。想卢凯彤了,推荐,35,30166972,少年的你
